{
  "$schema": "./model-capabilities.schema.json",
  "version": 2,
  "updatedAt": "2026-03-06T00:00:00.000Z",
  "description": "Dynamic model capability registry. The orchestrator scores models against task requirements to route work to the best available model. Add new models by appending entries — no code changes needed.",
  "taskDimensions": [
    "code_generation",
    "bug_fixing",
    "agentic_execution",
    "architecture_reasoning",
    "algorithmic_math",
    "large_codebase_nav",
    "code_review",
    "test_generation",
    "documentation",
    "frontend_ui",
    "computer_use",
    "multilingual_code",
    "security_analysis",
    "fast_simple_tasks"
  ],
  "tiers": {
    "nano":      { "maxCostInputPerMToken": 0.50,  "description": "Ultra-fast, ultra-cheap. Route trivial tasks here." },
    "mini":      { "maxCostInputPerMToken": 1.50,  "description": "High-throughput small frontier-class workers for parallel coding tasks." },
    "mid":       { "maxCostInputPerMToken": 3.00,  "description": "Balanced cost/quality for standard coding tasks." },
    "frontier":  { "maxCostInputPerMToken": 15.00, "description": "Best general capability. Default for complex tasks." },
    "reasoning": { "maxCostInputPerMToken": 999.00, "description": "Extended thinking, deep analysis. Use for architecture and debugging." }
  },
  "models": [
    {
      "candidateId": "codex-5.3",
      "provider": "codex",
      "model": "codex-5.3",
      "displayName": "Codex 5.3 (GPT-5.3-Codex)",
      "family": "openai",
      "tier": "frontier",
      "releasedAt": "2026-02",
      "contextWindow": 400000,
      "maxOutputTokens": 128000,
      "supportsTools": true,
      "supportsVision": false,
      "supportsAudio": false,
      "supportsStreaming": true,
      "supportsExtendedThinking": false,
      "pricing": { "inputPerMTokens": 10.00, "outputPerMTokens": 30.00 },
      "benchmarks": {
        "swebench_verified": null,
        "swebench_pro": 56.8,
        "terminal_bench_2": 77.3,
        "livecodebench_elo": null,
        "humaneval": null,
        "arc_agi_2": null,
        "osworld_verified": null,
        "aime": null,
        "gpqa_diamond": null,
        "webdev_arena_elo": null
      },
      "taskScores": {
        "code_generation": 8.5,
        "bug_fixing": 7.5,
        "agentic_execution": 9.7,
        "architecture_reasoning": 7.0,
        "algorithmic_math": 7.0,
        "large_codebase_nav": 8.0,
        "code_review": 7.0,
        "test_generation": 7.5,
        "documentation": 6.5,
        "frontend_ui": 7.0,
        "computer_use": 6.0,
        "multilingual_code": 7.5,
        "security_analysis": 9.0,
        "fast_simple_tasks": 5.0
      },
      "strengths": ["terminal/agentic execution", "multi-step tool use", "security/CTF", "self-bootstrapping", "128K output"],
      "weaknesses": ["expensive", "no vision", "lower SWE-bench Verified equivalent"],
      "slo": { "p50LatencyMs": 1500, "p95LatencyMs": 8000, "tokensPerSecond": 150 },
      "notes": "Best-in-class for agentic terminal workflows. Uses SWE-Bench Pro (harder variant) so scores not directly comparable to Verified."
    },
    {
      "candidateId": "gpt-5.4",
      "provider": "openai",
      "model": "gpt-5.4",
      "displayName": "GPT-5.4",
      "family": "openai",
      "tier": "frontier",
      "releasedAt": "2026-03",
      "contextWindow": 1000000,
      "maxOutputTokens": 32000,
      "supportsTools": true,
      "supportsVision": true,
      "supportsAudio": true,
      "supportsStreaming": true,
      "supportsExtendedThinking": true,
      "pricing": { "inputPerMTokens": 2.50, "outputPerMTokens": 10.00 },
      "benchmarks": {
        "swebench_verified": 82,
        "swebench_pro": null,
        "terminal_bench_2": 78,
        "livecodebench_elo": null,
        "humaneval": 98,
        "arc_agi_2": null,
        "osworld_verified": null,
        "aime": null,
        "gpqa_diamond": null,
        "webdev_arena_elo": null
      },
      "taskScores": {
        "code_generation": 9.0,
        "bug_fixing": 8.5,
        "agentic_execution": 9.0,
        "architecture_reasoning": 8.5,
        "algorithmic_math": 8.5,
        "large_codebase_nav": 9.0,
        "code_review": 8.5,
        "test_generation": 8.5,
        "documentation": 8.0,
        "frontend_ui": 8.0,
        "computer_use": 8.5,
        "multilingual_code": 8.5,
        "security_analysis": 8.0,
        "fast_simple_tasks": 7.5
      },
      "strengths": ["all-round flagship", "computer use", "native vision/audio", "1M context", "extended thinking"],
      "weaknesses": ["newer model — less battle-tested", "moderate cost"],
      "slo": { "p50LatencyMs": 1200, "p95LatencyMs": 5000, "tokensPerSecond": 180 },
      "notes": "First general-purpose OpenAI model with native computer use. Combines Codex coding strengths + reasoning."
    },
    {
      "candidateId": "gpt-5.4-mini",
      "provider": "openai",
      "model": "gpt-5.4-mini",
      "displayName": "GPT-5.4 Mini",
      "family": "openai",
      "tier": "mini",
      "releasedAt": "2026-03",
      "contextWindow": 1000000,
      "maxOutputTokens": 32000,
      "supportsTools": true,
      "supportsVision": true,
      "supportsAudio": true,
      "supportsStreaming": true,
      "supportsExtendedThinking": true,
      "pricing": { "inputPerMTokens": 0.45, "outputPerMTokens": 1.80 },
      "benchmarks": {
        "swebench_verified": 74,
        "swebench_pro": null,
        "terminal_bench_2": 64,
        "livecodebench_elo": null,
        "humaneval": 94,
        "arc_agi_2": null,
        "osworld_verified": null,
        "aime": null,
        "gpqa_diamond": null,
        "webdev_arena_elo": null
      },
      "taskScores": {
        "code_generation": 8.2,
        "bug_fixing": 7.8,
        "agentic_execution": 8.0,
        "architecture_reasoning": 7.4,
        "algorithmic_math": 7.2,
        "large_codebase_nav": 7.8,
        "code_review": 7.6,
        "test_generation": 7.8,
        "documentation": 7.5,
        "frontend_ui": 7.5,
        "computer_use": 7.8,
        "multilingual_code": 7.8,
        "security_analysis": 7.1,
        "fast_simple_tasks": 9.3
      },
      "strengths": ["high-throughput coding", "cheap parallel workers", "strong enough for completion-driven execution", "1M context"],
      "weaknesses": ["weaker deep review than frontier models", "less margin for ambiguous planning tasks"],
      "slo": { "p50LatencyMs": 700, "p95LatencyMs": 2800, "tokensPerSecond": 320 },
      "notes": "Preferred default for high-volume coding workers and custom-agent fleets where orchestration quality matters more than single-call frontier strength."
    },
    {
      "candidateId": "gpt-5.2",
      "provider": "openai",
      "model": "gpt-5.2",
      "displayName": "GPT-5.2",
      "family": "openai",
      "tier": "frontier",
      "releasedAt": "2026-01",
      "contextWindow": 128000,
      "maxOutputTokens": 16384,
      "supportsTools": true,
      "supportsVision": true,
      "supportsAudio": false,
      "supportsStreaming": true,
      "supportsExtendedThinking": false,
      "pricing": { "inputPerMTokens": 1.75, "outputPerMTokens": 14.00 },
      "benchmarks": {
        "swebench_verified": 76,
        "swebench_pro": null,
        "terminal_bench_2": 44,
        "livecodebench_elo": 89,
        "humaneval": 96,
        "arc_agi_2": null,
        "osworld_verified": null,
        "aime": 100,
        "gpqa_diamond": null,
        "webdev_arena_elo": null
      },
      "taskScores": {
        "code_generation": 8.5,
        "bug_fixing": 8.0,
        "agentic_execution": 6.0,
        "architecture_reasoning": 8.0,
        "algorithmic_math": 9.5,
        "large_codebase_nav": 7.0,
        "code_review": 8.5,
        "test_generation": 8.0,
        "documentation": 8.0,
        "frontend_ui": 7.5,
        "computer_use": 5.0,
        "multilingual_code": 8.0,
        "security_analysis": 7.5,
        "fast_simple_tasks": 7.0
      },
      "strengths": ["mathematical reasoning (AIME 100%)", "cost-effective frontier", "strong code review"],
      "weaknesses": ["weak terminal/agentic execution", "no computer use", "128K context limit"],
      "slo": { "p50LatencyMs": 1000, "p95LatencyMs": 4000, "tokensPerSecond": 200 },
      "notes": "Battle-tested frontier model. Excellent for evaluation and mathematical tasks."
    },
    {
      "candidateId": "claude-opus-4.6",
      "provider": "anthropic",
      "model": "claude-opus-4-6",
      "displayName": "Claude Opus 4.6",
      "family": "anthropic",
      "tier": "reasoning",
      "releasedAt": "2026-02",
      "contextWindow": 200000,
      "maxOutputTokens": 32000,
      "supportsTools": true,
      "supportsVision": true,
      "supportsAudio": false,
      "supportsStreaming": true,
      "supportsExtendedThinking": true,
      "pricing": { "inputPerMTokens": 15.00, "outputPerMTokens": 75.00 },
      "benchmarks": {
        "swebench_verified": 80.8,
        "swebench_pro": null,
        "terminal_bench_2": 65.4,
        "livecodebench_elo": null,
        "humaneval": 97,
        "arc_agi_2": null,
        "osworld_verified": 72.7,
        "aime": null,
        "gpqa_diamond": null,
        "webdev_arena_elo": null
      },
      "taskScores": {
        "code_generation": 9.0,
        "bug_fixing": 9.5,
        "agentic_execution": 7.5,
        "architecture_reasoning": 9.5,
        "algorithmic_math": 8.0,
        "large_codebase_nav": 7.5,
        "code_review": 9.5,
        "test_generation": 9.0,
        "documentation": 9.0,
        "frontend_ui": 8.0,
        "computer_use": 9.0,
        "multilingual_code": 8.5,
        "security_analysis": 8.5,
        "fast_simple_tasks": 3.0
      },
      "strengths": ["real-world bug fixing (SWE-bench leader)", "architecture/system design", "extended thinking", "code review", "developer preference winner", "computer use"],